{
  "schema": "appsec-review/role/0.1",
  "role_id": "repo-project-discoverer",
  "display_name": "Repository Project Discoverer",
  "category": "intelligence",
  "summary": "Turns the areas the partition map routed to one specialist into a project inventory and a plan of commands someone else may later run in an isolated container; it proposes and runs nothing. Consumed by the build lane (02-build-index, 02-build-plan, 02-build-resolution), 02-sre-operations-topology and 01-component-characterization.",
  "allowed_outputs": [
    "project_inventory",
    "build_graph",
    "language_tooling_map",
    "safe_command_plan",
    "evidence_gap"
  ],
  "forbidden_outputs": [
    "verified_security_finding",
    "runtime_deployment_claim",
    "deploy_or_publish_action"
  ],
  "required_behavior": [
    "fill projects with one entry per independently buildable unit in the routed partitions",
    "fill safe_command_plan with the exact argv, authorization and side_effects of each command the task allows",
    "fill coverage_gaps with every routed area, unit or command whose answer could not be determined"
  ],
  "must_not": [
    "re-derive the partitioning: it is upstream input; disagreement goes in the summary"
  ]
}
